<?xml version="1.0" encoding="utf-8"?>
<!DOCTYPE gov_uscourts_docket SYSTEM "docket.dtd">
<gov_uscourts_docket>
  <nonce>KBWIzM</nonce>
  <case_details>
    <court>caed</court>
    <docket_num>1:09-cv-00515</docket_num>
    <case_name>(PC) Mitchell v. Rennick et al</case_name>
    <pacer_case_num>7830</pacer_case_num>
    <date_case_filed>2009-03-20</date_case_filed>
    <assigned_to>Magistrate Judge Sandra M. Snyder</assigned_to>
    <case_cause>42:1983 Prisoner Civil Rights</case_cause>
    <nature_of_suit>550 Prisoner: Civil Rights</nature_of_suit>
    <jury_demand>None</jury_demand>
    <jurisdiction>Federal Question</jurisdiction>
  </case_details>
  <party_list>
    <party>
      <name>Corey Mitchell</name>
      <type>Plaintiff</type>
      <attorney_list>
        <attorney>
          <attorney_name>Corey Mitchell</attorney_name>
          <contact>F-23331
SALINAS VALLEY STATE PRISON (1050)
PO BOX 1050
SOLEDAD, CA 93960-1050
PRO SE</contact>
        </attorney>
      </attorney_list>
    </party>
    <party>
      <name>Rennick</name>
      <type>Defendant</type>
      <extra_info>Correctional Officer</extra_info>
    </party>
    <party>
      <name>Bott</name>
      <type>Defendant</type>
      <extra_info>Correctional Officer</extra_info>
    </party>
    <party>
      <name>- Palmer</name>
      <type>Defendant</type>
      <extra_info>Correctional Officer</extra_info>
    </party>
  </party_list>
  <document_list>
    <document doc_num="1" attachment_num="0">
      <pacer_doc_id>03303140067</pacer_doc_id>
      <date_filed>2009-03-19</date_filed>
      <long_desc>PRISONER CIVIL RIGHTS COMPLAINT against Rennick, Bott, Palmer, W Williams, Demery by Corey Mitchell.(Figueroa, O) (Entered: 03/20/2009)</long_desc>
    </document>
  </document_list>
</gov_uscourts_docket>

